{
  "decision_skeleton_id": "plan-pipeline-smoke-d1",
  "control_packet_id": "plan-pipeline-smoke-c1",
  "objective": "Produce one read-only verification packet for the LOOP plan pipeline smoke.",
  "definition_of_done": ["The expansion contains exactly one read-only packet."],
  "constraints": [
    {"id": "c-read-only", "text": "No files, services, or processes may be changed."}
  ],
  "decisions": [
    {"id": "d-one-packet", "text": "Create exactly one verification packet.", "authority": "sol"}
  ],
  "allowed_side_effects": [],
  "risk_class": "low",
  "evidence_roots": ["config/orchestration_policy.toml"],
  "unresolved_choices": []
}
